{
  "prdId": "PRD-001",
  "version": "1.0.0",
  "status": "draft",
  "stories": [
    {
      "id": "US-001",
      "reqId": "REQ-001",
      "title": "Manage sync allow-list",
      "description": "As a documentation administrator, I want to manage the allow-list of Confluence labels and source spaces that are eligible to sync so that only intentionally-tagged pages can ever be published to the client portal.",
      "asA": "documentation administrator",
      "iWant": "to manage the allow-list of Confluence labels and source spaces that are eligible to sync",
      "soThat": "only intentionally-tagged pages can ever be published to the client portal",
      "acceptanceCriteria": [
        {
          "id": "AC-001",
          "description": "Given an admin opens the sync configuration page, when they add a label to the allow-list and save, then the label appears in the active list and the change is audit-logged with the admin's identity and timestamp.",
          "testable": true
        },
        {
          "id": "AC-002",
          "description": "Given an admin removes a label from the allow-list, when the next sync cycle runs, then pages whose only allow-list match was that label are unpublished from the portal and the unpublish is audit-logged.",
          "testable": true
        },
        {
          "id": "AC-003",
          "description": "Given an unauthenticated user or a user without the admin role, when they request the sync configuration page, then they receive a 403 and the attempt is audit-logged.",
          "testable": true
        }
      ]
    },
    {
      "id": "US-002",
      "reqId": "REQ-001",
      "title": "Sync engine respects allow-list",
      "description": "As a sync engine, I want to evaluate each candidate Confluence page against the active allow-list before considering it for publish so that pages outside the configured tag/space scope never enter the publishing pipeline.",
      "asA": "sync engine",
      "iWant": "to evaluate each candidate Confluence page against the active allow-list before considering it for publish",
      "soThat": "pages outside the configured tag/space scope never enter the publishing pipeline",
      "acceptanceCriteria": [
        {
          "id": "AC-004",
          "description": "Given a Confluence page that carries no allow-listed label and lives outside any allow-listed space, when the sync cycle runs, then the page is skipped and a debug-level log records the skip with the page ID.",
          "testable": true
        },
        {
          "id": "AC-005",
          "description": "Given a Confluence page that carries at least one allow-listed label, when the sync cycle runs, then the page proceeds to the approval-state check (REQ-002).",
          "testable": true
        },
        {
          "id": "AC-006",
          "description": "Given the allow-list is empty, when the sync cycle runs, then zero pages are published and an admin-visible warning is surfaced.",
          "testable": true
        }
      ]
    },
    {
      "id": "US-003",
      "reqId": "REQ-002",
      "title": "Approval-state gating",
      "description": "As a publishing pipeline, I want to publish only Confluence pages whose configured approval signal is present so that drafts and in-review pages never reach clients.",
      "asA": "publishing pipeline",
      "iWant": "to publish only Confluence pages whose configured approval signal is present",
      "soThat": "drafts and in-review pages never reach clients",
      "acceptanceCriteria": [
        {
          "id": "AC-007",
          "description": "Given a Confluence page with the configured approval signal absent (e.g. draft state, missing approval label), when the sync evaluates it, then publishing is blocked and the page does not appear on the portal.",
          "testable": true
        },
        {
          "id": "AC-008",
          "description": "Given a Confluence page with the configured approval signal present, when the sync evaluates it, then it proceeds to the AI document-review stage (REQ-040).",
          "testable": true
        },
        {
          "id": "AC-009",
          "description": "Given an admin reconfigures the approval signal, when the change is saved, then the active signal is logged and the next sync cycle applies the new rule.",
          "testable": true
        }
      ]
    },
    {
      "id": "US-004",
      "reqId": "REQ-002",
      "title": "Loss of approval triggers unpublish",
      "description": "As a publishing pipeline, I want to unpublish a page that loses its approval state after publish so that the portal never serves content that has reverted to draft.",
      "asA": "publishing pipeline",
      "iWant": "to unpublish a page that loses its approval state after publish",
      "soThat": "the portal never serves content that has reverted to draft",
      "acceptanceCriteria": [
        {
          "id": "AC-010",
          "description": "Given a previously published page, when its approval signal is removed in Confluence, then on the next sync cycle the page is unpublished from the portal within 5 minutes (p95).",
          "testable": true
        },
        {
          "id": "AC-011",
          "description": "Given a page is unpublished due to loss of approval, when a client navigates to its URL, then they receive a clear 'not available' message rather than a stale cached copy.",
          "testable": true
        },
        {
          "id": "AC-012",
          "description": "Given a page is unpublished due to loss of approval, when the unpublish completes, then the version history of that page is preserved and the unpublish event is audit-logged with cause = 'approval-state-loss'.",
          "testable": true
        }
      ]
    },
    {
      "id": "US-005",
      "reqId": "REQ-003",
      "title": "Webhook-driven sync within SLA",
      "description": "As a sync engine, I want to receive Confluence page-change webhooks and publish updates within the SLA so that approved changes reach the portal in near real-time without operator action.",
      "asA": "sync engine",
      "iWant": "to receive Confluence page-change webhooks and publish updates within the SLA",
      "soThat": "approved changes reach the portal in near real-time without operator action",
      "acceptanceCriteria": [
        {
          "id": "AC-013",
          "description": "Given a webhook event arrives for an approved, allow-listed page, when the sync pipeline processes it, then the new version is visible on the portal within 5 minutes at p95 measured from webhook receipt to portal cache hit.",
          "testable": true
        },
        {
          "id": "AC-014",
          "description": "Given the webhook delivery is duplicated (Confluence retries), when the pipeline processes the duplicate, then no duplicate version is created and the duplicate is recorded as deduped in logs.",
          "testable": true
        },
        {
          "id": "AC-015",
          "description": "Given a webhook payload that fails schema validation, when received, then the event is rejected with a 400 and an alert is raised, with no partial publish.",
          "testable": true
        }
      ]
    },
    {
      "id": "US-006",
      "reqId": "REQ-003",
      "title": "Polling sync fallback",
      "description": "As a sync engine, I want to fall back to a polling sync on a configurable interval when webhooks are unavailable so that the portal stays in sync even if Confluence cannot deliver webhooks.",
      "asA": "sync engine",
      "iWant": "to fall back to a polling sync on a configurable interval when webhooks are unavailable",
      "soThat": "the portal stays in sync even if Confluence cannot deliver webhooks",
      "acceptanceCriteria": [
        {
          "id": "AC-016",
          "description": "Given webhooks have been disabled or have failed for longer than a configurable threshold, when the polling interval elapses, then the engine fetches the recently-changed page list from Confluence and processes eligible pages.",
          "testable": true
        },
        {
          "id": "AC-017",
          "description": "Given polling is active and a page has been updated since the last poll, when the engine processes it, then it follows the same allow-list \u2192 approval \u2192 AI-review path as webhook-driven sync.",
          "testable": true
        },
        {
          "id": "AC-018",
          "description": "Given webhooks recover, when the first webhook arrives after recovery, then polling continues for one additional cycle to backfill any missed events, then quiesces.",
          "testable": true
        }
      ]
    },
    {
      "id": "US-007",
      "reqId": "REQ-003",
      "title": "Sync latency observability",
      "description": "As a platform engineer, I want to observe sync latency as a first-class metric with alerting so that the SLA is enforced operationally and regressions are caught before clients notice.",
      "asA": "platform engineer",
      "iWant": "to observe sync latency as a first-class metric with alerting",
      "soThat": "the SLA is enforced operationally and regressions are caught before clients notice",
      "acceptanceCriteria": [
        {
          "id": "AC-019",
          "description": "Given the sync pipeline is running, when a page completes publishing, then the end-to-end latency from approval to portal visibility is emitted as a histogram metric tagged by page and pipeline stage.",
          "testable": true
        },
        {
          "id": "AC-020",
          "description": "Given p95 sync latency exceeds 5 minutes over a rolling 15-minute window, when the threshold is breached, then a paging alert is fired to the on-call channel.",
          "testable": true
        },
        {
          "id": "AC-021",